{
  "$schema": "https://json-schema.org/draft/2020-12/schema",
  "$id": "https://aoa.local/aoa-routing/schemas/adoption_escalation_route_v1.json",
  "title": "adoption_escalation_route v1",
  "type": "object",
  "required": [
    "schema_id",
    "kind",
    "version",
    "status",
    "summary",
    "refs",
    "payload"
  ],
  "additionalProperties": false,
  "properties": {
    "schema_id": {
      "type": "string",
      "const": "adoption_escalation_route_v1"
    },
    "kind": {
      "type": "string",
      "const": "adoption_escalation_route"
    },
    "version": {
      "type": "string",
      "const": "1.0"
    },
    "status": {
      "type": "string",
      "enum": [
        "draft",
        "proposed",
        "approved",
        "blocked",
        "passed",
        "failed",
        "active",
        "retired",
        "shadow",
        "quarantined"
      ]
    },
    "summary": {
      "type": "string",
      "minLength": 4
    },
    "refs": {
      "type": "object",
      "required": [
        "source",
        "owner",
        "related"
      ],
      "additionalProperties": false,
      "properties": {
        "source": {
          "type": "string"
        },
        "owner": {
          "type": "string"
        },
        "related": {
          "type": "array",
          "items": {
            "type": "string"
          }
        }
      }
    },
    "payload": {
      "type": "object",
      "required": [
        "wave",
        "repo",
        "pattern_ref",
        "owner_surface",
        "requires_owner_consent",
        "rollback_required",
        "retention_cycles",
        "routing_role",
        "meaning_authority"
      ],
      "additionalProperties": false,
      "properties": {
        "wave": {
          "type": "string"
        },
        "repo": {
          "type": "string"
        },
        "pattern_ref": {
          "type": "string"
        },
        "owner_surface": {
          "type": "string"
        },
        "requires_owner_consent": {
          "type": "boolean",
          "const": true
        },
        "rollback_required": {
          "type": "boolean",
          "const": true
        },
        "retention_cycles": {
          "type": "integer",
          "minimum": 0
        },
        "routing_role": {
          "type": "string"
        },
        "meaning_authority": {
          "type": "boolean",
          "const": false
        }
      }
    }
  }
}
